detailed_work_activity,impact,intermediate_work_activity,element
"Move products, materials, or equipment between work areas.",-0.1046070384869422,"Move materials, equipment, or supplies.",Performing General Physical Activities
Navigate water vessels.,0.3133386282943551,Operate transportation equipment or vehicles.,"Operating Vehicles, Mechanized Devices, or Equipment"
Negotiate agreements to resolve disputes.,-0.12341463175950995,Negotiate contracts or agreements.,Resolving Conflicts and Negotiating with Others
"Negotiate contracts for environmental remediation, green energy, or renewable resources.",-0.007593860569699018,Negotiate contracts or agreements.,Resolving Conflicts and Negotiating with Others
"Negotiate contracts for transportation, distribution, or logistics services.",-0.17557140682022077,Negotiate contracts or agreements.,Resolving Conflicts and Negotiating with Others
Negotiate contracts with clients or service providers.,-0.17437336447485619,Negotiate contracts or agreements.,Resolving Conflicts and Negotiating with Others
Negotiate financial arrangements.,0.06811609096409565,Negotiate contracts or agreements.,Resolving Conflicts and Negotiating with Others
Negotiate for services.,0.19925755311866222,Negotiate contracts or agreements.,Resolving Conflicts and Negotiating with Others
Negotiate labor disputes.,0.015139323072799638,Negotiate contracts or agreements.,Resolving Conflicts and Negotiating with Others
Negotiate prices or other sales terms.,-0.14849151385526982,Negotiate contracts or agreements.,Resolving Conflicts and Negotiating with Others
Negotiate project specifications.,-0.11031019861371227,Negotiate contracts or agreements.,Resolving Conflicts and Negotiating with Others
Negotiate purchases or contracts.,0.01767684737117925,Negotiate contracts or agreements.,Resolving Conflicts and Negotiating with Others
Negotiate sales or lease agreements for products or services.,0.43547166661672376,Negotiate contracts or agreements.,Resolving Conflicts and Negotiating with Others
"Notify others of emergencies, problems, or hazards.",-0.45098310407672626,Notify others of emergencies or problems.,"Communicating with Supervisors, Peers, or Subordinates"
Notify others of equipment problems.,-0.060446799153505815,Notify others of emergencies or problems.,"Communicating with Supervisors, Peers, or Subordinates"
Notify others of equipment repair or maintenance needs.,-0.20325449542565632,Notify others of emergencies or problems.,"Communicating with Supervisors, Peers, or Subordinates"
Observe equipment in operation to detect potential problems.,0.03458036953595922,Monitor equipment operation.,"Monitor Processes, Materials, or Surroundings"
Observe individuals' activities to gather information or compile evidence.,0.058675931406358295,"Investigate individuals' background, behavior, or activities.",Getting Information
Obtain copyrights or other legal permissions.,-0.13566500401165804,Obtain formal documentation or authorization.,Getting Information
Obtain documentation to authorize activities.,-0.10618067759115846,Obtain formal documentation or authorization.,Getting Information
Obtain information about goods or services.,-0.05432745294459407,Obtain information about goods or services.,Getting Information
Obtain personal or financial information about customers or applicants.,0.1892517770168074,Collect data about consumer needs or opinions.,Getting Information
Obtain property information.,-0.009549365646079,Gather information from physical or electronic sources.,Getting Information
Obtain written authorization to perform activities.,-0.0013945365391183628,Obtain formal documentation or authorization.,Getting Information
Operate audio recording equipment.,0.20976398356808845,Operate audiovisual or related equipment.,Controlling Machines and Processes
Operate audio-visual equipment.,0.0,Operate audiovisual or related equipment.,Controlling Machines and Processes
Operate audiovisual equipment.,-0.0330385240700366,Operate audiovisual or related equipment.,Controlling Machines and Processes
Operate biomass or biofuel production equipment.,0.0,Operate energy production or distribution equipment.,Controlling Machines and Processes
Operate cash registers.,0.013142213055399754,Execute financial transactions.,Performing Administrative Activities
Operate chemical processing or water treatment systems or equipment.,-0.4046560807954598,Operate industrial processing or production equipment.,Controlling Machines and Processes
Operate communications equipment or systems.,-0.698902500841732,Operate communications equipment or systems.,Controlling Machines and Processes
"Operate communications, transmissions, or broadcasting equipment.",0.25361915327403484,Operate communications equipment or systems.,Controlling Machines and Processes
Operate computer systems.,-0.15569581682522093,Operate computer systems or computerized equipment.,Interacting With Computers
Operate computers or computerized equipment.,0.054483230550519846,Operate computer systems or computerized equipment.,Interacting With Computers
"Operate control consoles for sound, lighting or video.",0.11821553412629449,Operate audiovisual or related equipment.,Controlling Machines and Processes
Operate conveyors or other industrial material moving equipment.,0.06465707968952339,Operate industrial processing or production equipment.,Controlling Machines and Processes
"Operate cooking, baking, or other food preparation equipment.",0.7328803677995115,Operate industrial processing or production equipment.,Controlling Machines and Processes
"Operate cranes, hoists, or other moving or lifting equipment.",2.6693400959295315,Operate lifting or moving equipment.,Controlling Machines and Processes
Operate cutting equipment.,0.7289050873315239,Operate cutting or grinding equipment.,Controlling Machines and Processes
Operate detonation equipment.,-0.0824549372871588,Operate construction or excavation equipment.,Controlling Machines and Processes
Operate diagnostic imaging equipment.,-0.12884548886221703,Operate medical equipment.,Controlling Machines and Processes
Operate diagnostic or therapeutic medical instruments or equipment.,-0.014693979747717467,Operate medical equipment.,Controlling Machines and Processes
Operate digital imaging equipment.,0.08947534301782989,Process digital or online data.,Interacting With Computers
Operate drilling equipment.,-0.19088236421435223,Operate construction or excavation equipment.,Controlling Machines and Processes
Operate energy distribution equipment.,-0.03880896612436624,Operate energy production or distribution equipment.,Controlling Machines and Processes
Operate energy production equipment.,0.06957078059370403,Operate energy production or distribution equipment.,Controlling Machines and Processes
Operate equipment or vehicles to clear construction sites or move materials.,-0.060284963215971654,Operate construction or excavation equipment.,Controlling Machines and Processes
Operate equipment to print images or bind printed images together.,-0.0013489743206016591,Operate industrial processing or production equipment.,Controlling Machines and Processes
Operate excavation equipment.,0.04230426371238316,Operate construction or excavation equipment.,Controlling Machines and Processes
Operate farming equipment.,0.2306236300454576,Operate agricultural or forestry equipment.,Controlling Machines and Processes
Operate firefighting equipment.,-0.01929545094744789,Protect people or property from threats such as fires or flooding.,Performing General Physical Activities
Operate forestry equipment.,0.31951424209230117,Operate agricultural or forestry equipment.,Controlling Machines and Processes
Operate forklifts or other loaders.,0.0783301838763859,Operate lifting or moving equipment.,Controlling Machines and Processes
Operate gaming equipment.,0.15016669671756366,Conduct amusement or gaming activities.,Performing for or Working Directly with the Public
Operate garment treatment equipment.,0.22957263264346217,"Clean workpieces, finished products, or other objects.",Performing General Physical Activities
Operate green energy production equipment.,0.0,Operate energy production or distribution equipment.,Controlling Machines and Processes
Operate grinding equipment.,0.44478194230063606,Operate cutting or grinding equipment.,Controlling Machines and Processes
Operate grounds maintenance equipment.,-0.06571366455819394,Operate agricultural or forestry equipment.,Controlling Machines and Processes
Operate heating or drying equipment.,0.04268115372491188,Operate industrial processing or production equipment.,Controlling Machines and Processes
Operate heavy-duty construction or installation equipment.,0.12266535499084918,Operate construction or excavation equipment.,Controlling Machines and Processes
Operate industrial equipment.,0.21471414716844395,Operate industrial processing or production equipment.,Controlling Machines and Processes
Operate irrigation systems.,0.012305915837460102,Operate agricultural or forestry equipment.,Controlling Machines and Processes
Operate laboratory equipment to analyze medical samples.,0.0,Operate laboratory or field equipment.,Controlling Machines and Processes
Operate laboratory or field equipment.,-0.35959709226386805,Operate laboratory or field equipment.,Controlling Machines and Processes
Operate locomotives or other rail vehicles.,0.08890102962914836,Operate transportation equipment or vehicles.,"Operating Vehicles, Mechanized Devices, or Equipment"
Operate medical equipment.,0.08927871166072787,Operate medical equipment.,Controlling Machines and Processes
Operate metal or plastic forming equipment.,0.1589366886479362,Operate industrial processing or production equipment.,Controlling Machines and Processes
Operate mining equipment.,0.06413182316417254,Operate construction or excavation equipment.,Controlling Machines and Processes
Operate mixing equipment.,1.458649613553328,Operate industrial processing or production equipment.,Controlling Machines and Processes
Operate natural gas distribution equipment.,-0.19697493463690208,Operate energy production or distribution equipment.,Controlling Machines and Processes
Operate natural gas generation equipment.,0.1306888583914234,Operate energy production or distribution equipment.,Controlling Machines and Processes
Operate office equipment.,-0.49071781067986775,Operate office equipment.,Controlling Machines and Processes
Operate on patients to treat conditions.,0.4213192270429853,"Treat injuries, illnesses, or diseases.",Assisting and Caring for Others
Operate packing or other material processing equipment.,-0.012401181382903914,Operate industrial processing or production equipment.,Controlling Machines and Processes
Operate painting or coating equipment.,0.07082624471192656,Operate industrial processing or production equipment.,Controlling Machines and Processes
Operate photographic developing or print production equipment.,-0.12295958843485044,Operate industrial processing or production equipment.,Controlling Machines and Processes
Operate precision equipment to control microscopic or nanoscopic processes.,0.0,Operate laboratory or field equipment.,Controlling Machines and Processes
Operate pumping systems or equipment.,1.0598048164445903,Operate pumping systems or equipment.,Controlling Machines and Processes
Operate pumps or compressors.,-0.11019873209356756,Operate pumping systems or equipment.,Controlling Machines and Processes
Operate recycling equipment.,0.09602364464951663,Operate industrial processing or production equipment.,Controlling Machines and Processes
Operate road-surfacing equipment.,0.24137502071147443,Operate construction or excavation equipment.,Controlling Machines and Processes
Operate sewing equipment.,-0.26243525157189573,Sew garments or materials.,Handling and Moving Objects
Operate ships or other watercraft.,0.6037004072563583,Operate transportation equipment or vehicles.,"Operating Vehicles, Mechanized Devices, or Equipment"
Operate still or video cameras or related equipment.,0.141586192548659,Operate audiovisual or related equipment.,Controlling Machines and Processes
Operate surveillance equipment to detect suspicious or illegal activities.,-0.0979455933920943,Operate audiovisual or related equipment.,Controlling Machines and Processes
Operate textile cutting or production equipment.,-1.0115969757745558,Operate cutting or grinding equipment.,Controlling Machines and Processes
Operate transportation equipment to demonstrate function or malfunction.,0.03860933983293746,Operate transportation equipment or vehicles.,"Operating Vehicles, Mechanized Devices, or Equipment"
Operate vehicles or material-moving equipment.,0.4931161914907878,Operate transportation equipment or vehicles.,"Operating Vehicles, Mechanized Devices, or Equipment"
Operate welding equipment.,0.281886883274697,"Join parts using soldering, welding, or brazing techniques.",Handling and Moving Objects
Operate woodworking equipment.,0.523338281440676,Operate cutting or grinding equipment.,Controlling Machines and Processes
Order construction or extraction materials or equipment.,0.1611525177146289,Purchase goods or services.,Monitoring and Controlling Resources
Order instructional or library materials or equipment.,0.6229934129072929,Purchase goods or services.,Monitoring and Controlling Resources
"Order materials, supplies, or equipment.",-0.24356703518391498,Purchase goods or services.,Monitoring and Controlling Resources
Order medical diagnostic or clinical tests.,-0.06421084102694552,Order medical tests or procedures.,Monitoring and Controlling Resources
Order medical supplies or equipment.,-0.3666201843429655,Purchase goods or services.,Monitoring and Controlling Resources
Organize informational materials.,0.28991090941918074,Prepare informational or instructional materials.,Documenting/Recording Information
Organize recreational activities or events.,0.08676131619851102,"Coordinate group, community, or public activities.","Guiding, Directing, and Motivating Subordinates"
Organize special events.,0.19193186425180464,"Coordinate group, community, or public activities.","Guiding, Directing, and Motivating Subordinates"
Oversee business processes.,-0.07445005868637855,"Direct organizational operations, activities, or procedures.","Guiding, Directing, and Motivating Subordinates"
Package agricultural products for shipment or further processing.,0.35999327746607745,Package objects.,Handling and Moving Objects
Package food or supplies.,0.05940390928910011,Package objects.,Handling and Moving Objects
Package materials for transport.,-0.07939498144980917,Package objects.,Handling and Moving Objects
Package materials or products.,-0.27093578190986767,Package objects.,Handling and Moving Objects
Package objects for shipping.,0.28769048541060505,Package objects.,Handling and Moving Objects
Package products for storage or shipment.,0.8168505917990094,Package objects.,Handling and Moving Objects
Paint surfaces or equipment.,-0.1615762781489165,Apply protective solutions or coatings.,Handling and Moving Objects
Participate in athletic events.,0.0036125065060352846,"Perform athletic activities for fitness, competition, or artistic purposes.",Performing General Physical Activities
Participate in physical training to maintain fitness.,0.000945112212697552,"Perform athletic activities for fitness, competition, or artistic purposes.",Performing General Physical Activities
Participate in staffing decisions.,-0.03366468123205335,Perform recruiting or hiring activities.,Staffing Organizational Units
Patrol natural areas to ensure safety or enforce regulations.,-0.04179827515529766,"Monitor safety or security of work areas, facilities, or properties.","Monitor Processes, Materials, or Surroundings"
Patrol properties to maintain safety.,0.1066564694940717,"Monitor safety or security of work areas, facilities, or properties.","Monitor Processes, Materials, or Surroundings"
"Pay charges, fees, or taxes.",0.04774611567094267,Execute financial transactions.,Performing Administrative Activities
Perform administrative or clerical tasks.,0.1960880857049867,Perform administrative or clerical activities.,Performing Administrative Activities
Perform animal breeding procedures.,0.04933631836722885,Care for plants or animals.,Assisting and Caring for Others
Perform basic equipment maintenance.,0.05184483247726401,Maintain facilities or equipment.,Repairing and Maintaining Mechanical Equipment
Perform clerical work in medical settings.,-0.08392717975319508,Perform administrative or clerical activities.,Performing Administrative Activities
Perform dances.,0.07602582245369671,Present arts or entertainment performances.,Performing for or Working Directly with the Public
Perform for recordings.,-0.19127321035158262,Present arts or entertainment performances.,Performing for or Working Directly with the Public
Perform forest firefighting activities.,-0.0934169402524283,Protect people or property from threats such as fires or flooding.,Performing General Physical Activities
Perform housekeeping duties.,0.12368329235665332,"Clean tools, equipment, facilities, or work areas.",Performing General Physical Activities
Perform human resources activities.,0.09828253388439423,Perform human resources activities.,Staffing Organizational Units
"Perform manual agricultural, aquacultural, or horticultural tasks.",-0.19498006961233605,Perform agricultural activities.,Performing General Physical Activities
Perform manual service or maintenance tasks.,-0.3041733507822193,Maintain tools or equipment.,Repairing and Maintaining Mechanical Equipment
Perform marketing activities.,0.01302361976991051,"Promote products, services, or programs.",Selling or Influencing Others
Perform music for the public.,0.19221861817885078,Present arts or entertainment performances.,Performing for or Working Directly with the Public
Perform student enrollment or registration activities.,0.035120388340802666,Perform administrative or clerical activities.,Performing Administrative Activities
Pilot aircraft.,0.09897165589105628,Operate transportation equipment or vehicles.,"Operating Vehicles, Mechanized Devices, or Equipment"
Place materials into molds.,0.004872241342084749,"Load products, materials, or equipment for transportation or further processing.",Performing General Physical Activities
Plan biological research.,0.01484783626277153,Develop research plans or methodologies.,Thinking Creatively
Plan community programs or activities for the general public.,-0.7500093541473065,Plan events or programs.,"Organizing, Planning, and Prioritizing Work"
"Plan conferences, programs, or special events.",-0.0012311081623792575,Plan events or programs.,"Organizing, Planning, and Prioritizing Work"
Plan educational activities.,0.5885340893271498,"Develop educational programs, plans, or procedures.",Thinking Creatively
Plan employee work schedules.,0.033045876030493915,Assign work to others.,"Guiding, Directing, and Motivating Subordinates"
Plan environmental research.,-0.14409387432543186,Develop research plans or methodologies.,Thinking Creatively
Plan experiential learning activities.,0.08477391724775751,"Develop educational programs, plans, or procedures.",Thinking Creatively
Plan facility layouts or designs.,0.12537102570325898,Design structures or facilities.,Thinking Creatively
Plan flight operations.,-0.05940414912132708,Plan work activities.,"Organizing, Planning, and Prioritizing Work"
Plan implementation or promotion of recycling programs.,0.0,Plan events or programs.,"Organizing, Planning, and Prioritizing Work"
"Plan layout of construction, installation, or repairs.",0.21670279533342462,Plan work activities.,"Organizing, Planning, and Prioritizing Work"
Plan menu options.,-0.015324191898157036,Develop recipes or menus.,Thinking Creatively
Plan natural resources conservation or restoration programs.,-0.06166247388369017,Develop plans for managing or preserving natural resources.,Thinking Creatively
Plan production or operational procedures or sequences.,1.1230442155803004,Plan work activities.,"Organizing, Planning, and Prioritizing Work"
Plan programs to address community health issues.,-0.017098773455707317,Develop public or community health programs.,Thinking Creatively
Plan programs to address community mental wellness needs.,0.0,Develop public or community health programs.,Thinking Creatively
Plan social sciences research.,-0.08797088183467006,Develop research plans or methodologies.,Thinking Creatively
Plan special events.,0.07882444299142444,Plan events or programs.,"Organizing, Planning, and Prioritizing Work"
Plan trapping or hunting activities.,0.03682377713200946,Plan work activities.,"Organizing, Planning, and Prioritizing Work"
Plan work operations.,-0.03594738066534742,Plan work activities.,"Organizing, Planning, and Prioritizing Work"
Plan work procedures.,-0.14167870031990848,Plan work activities.,"Organizing, Planning, and Prioritizing Work"
"Plant crops, trees, or other plants.",0.0564231138213005,Perform agricultural activities.,Performing General Physical Activities
Plant greenery to improve landscape appearance.,0.0021287740204765093,Perform agricultural activities.,Performing General Physical Activities
"Polish materials, workpieces, or finished products.",0.1767224465444368,Smooth surfaces of objects or equipment.,Handling and Moving Objects
Position animal trapping or capture equipment.,-0.224457015030596,Position tools or equipment.,Handling and Moving Objects
Position construction forms or molds.,0.011631715390724828,Position tools or equipment.,Handling and Moving Objects
Position construction or extraction equipment.,-0.027372187822917837,Position tools or equipment.,Handling and Moving Objects
Position containers to receive materials or workpieces.,0.3876115039583974,Position tools or equipment.,Handling and Moving Objects
"Position equipment using hand tools, power tools, or heavy equipment.",-0.061358368972612265,Position tools or equipment.,Handling and Moving Objects
Position material handling equipment.,-0.07154091749008273,Position tools or equipment.,Handling and Moving Objects
Position patients for treatment or examination.,0.00252545353108502,Assist healthcare practitioners during medical procedures.,Assisting and Caring for Others
"Position patterns on equipment, materials, or workpieces.",-0.17347322703283652,Position tools or equipment.,Handling and Moving Objects
Position raw materials on processing or production equipment.,-0.2721270434195815,Position workpieces or materials on equipment.,Handling and Moving Objects
Position safety or support equipment.,0.10803147898833299,Position tools or equipment.,Handling and Moving Objects
Position structural components.,-0.010642105052984796,Position materials or components for assembly.,Handling and Moving Objects
Pour materials into or on designated areas.,0.06892347837124824,Perform general construction or extraction activities.,Performing General Physical Activities
Practice athletic or artistic skills.,-0.10837589408244153,"Perform athletic activities for fitness, competition, or artistic purposes.",Performing General Physical Activities
Prepare accident or incident reports.,-0.14041991875014448,Prepare reports of operational or procedural activities.,Documenting/Recording Information
Prepare activity or work schedules.,-0.05394009866188343,Assign work to others.,"Guiding, Directing, and Motivating Subordinates"
Prepare administrative documents.,0.018407672191988134,Perform administrative or clerical activities.,Performing Administrative Activities
Prepare analytical reports.,-0.32153143184964117,Present research or technical information.,Documenting/Recording Information
"Prepare biological feedstock for physical, chemical, or biological processing.",0.0,Prepare industrial materials for processing or use.,Handling and Moving Objects
Prepare biological samples for testing or analysis.,0.12674058724998005,Prepare specimens or materials for testing.,Handling and Moving Objects
Prepare biological specimens for laboratory analysis.,0.051622940989148436,Prepare specimens or materials for testing.,Handling and Moving Objects
Prepare breads or doughs.,0.0040607701711330435,Prepare foods or beverages.,Handling and Moving Objects
Prepare business correspondence.,-0.1486313742598666,Perform administrative or clerical activities.,Performing Administrative Activities
Prepare cash for deposit or disbursement.,0.11662409041373278,Reconcile financial data.,Processing Information
Prepare chemicals for work application.,-0.014599868777934955,Prepare mixtures or solutions.,Performing General Physical Activities
Prepare compounds or solutions for products or testing.,0.11921333093041264,Prepare specimens or materials for testing.,Handling and Moving Objects
Prepare compounds or solutions to be used for repairs.,-0.06967702211523807,Prepare mixtures or solutions.,Performing General Physical Activities
Prepare contracts or other transaction documents.,-0.08529742389324868,"Prepare documentation for contracts, applications, or permits.",Documenting/Recording Information
"Prepare contracts, disclosures, or applications.",0.02727654073054575,"Prepare documentation for contracts, applications, or permits.",Documenting/Recording Information
Prepare data for analysis.,-0.01613273834236173,Process digital or online data.,Interacting With Computers
Prepare detailed work plans.,-0.39320828665031105,Plan work activities.,"Organizing, Planning, and Prioritizing Work"
"Prepare documentation for contracts, transactions, or regulatory compliance.",-0.6752392762457258,"Prepare documentation for contracts, applications, or permits.",Documenting/Recording Information
Prepare documentation for permits or licenses.,0.043742928694198824,"Prepare documentation for contracts, applications, or permits.",Documenting/Recording Information
