detailed_work_activity,impact,intermediate_work_activity,element
Accompany individuals or groups to activities.,-0.02753279960387145,Escort others.,Performing General Physical Activities
Accompany patients or clients on outings to provide assistance.,0.034211309725759254,Escort others.,Performing General Physical Activities
Acquire supplies or equipment.,-0.28471427460310395,Purchase goods or services.,Monitoring and Controlling Resources
Add garnishes to food.,-0.005974809601390518,Prepare foods or beverages.,Handling and Moving Objects
Adjust dental devices or appliances to ensure fit.,-0.04950554193423251,Adjust medical equipment to ensure adequate performance.,Handling and Moving Objects
Adjust equipment controls to regulate coolant flow.,-0.5290314946892378,Adjust equipment to ensure adequate performance.,Handling and Moving Objects
Adjust equipment controls to regulate flow of production materials or products.,0.1807456973917274,Adjust equipment to ensure adequate performance.,Handling and Moving Objects
"Adjust equipment controls to regulate flow of water, cleaning solutions, or other liquids.",0.13301602232903864,Adjust equipment to ensure adequate performance.,Handling and Moving Objects
Adjust equipment controls to regulate gas flow.,-0.001868604754968306,Adjust equipment to ensure adequate performance.,Handling and Moving Objects
Adjust equipment to ensure optimal performance.,0.01781162521622992,Adjust equipment to ensure adequate performance.,Handling and Moving Objects
Adjust fabrics or other materials during garment production.,-0.23521039567845703,Position workpieces or materials on equipment.,Handling and Moving Objects
Adjust flow of electricity to tools or production equipment.,0.15315349478595186,Adjust equipment to ensure adequate performance.,Handling and Moving Objects
Adjust office equipment to ensure proper operation.,0.13645968429834943,Adjust equipment to ensure adequate performance.,Handling and Moving Objects
Adjust position of molds during processing.,0.09499217317130082,Position tools or equipment.,Handling and Moving Objects
Adjust positions of patients on beds or tables.,0.027941035247597057,Assist healthcare practitioners during medical procedures.,Assisting and Caring for Others
Adjust prostheses or other assistive devices.,0.08440693334532146,Adjust medical equipment to ensure adequate performance.,Handling and Moving Objects
Adjust routes or speeds as necessary.,0.1389037798613013,Plan work activities.,"Organizing, Planning, and Prioritizing Work"
Adjust settings or positions of medical equipment.,0.03866148368101774,Adjust equipment to ensure adequate performance.,Handling and Moving Objects
Adjust temperature controls of ovens or other heating equipment.,-1.5331405966295306,Adjust equipment to ensure adequate performance.,Handling and Moving Objects
Adjust the tension of nuts or bolts.,-0.01682578186206607,Adjust equipment to ensure adequate performance.,Handling and Moving Objects
Adjust tuning or functioning of musical instruments.,-0.07904252541311596,Adjust equipment to ensure adequate performance.,Handling and Moving Objects
Adjust vehicle components according to specifications.,-0.18541902551248413,Adjust equipment to ensure adequate performance.,Handling and Moving Objects
Administer anesthetics or sedatives to control pain.,-0.018407013810314954,Administer basic health care or medical treatments.,Assisting and Caring for Others
Administer basic health care or medical treatments.,-0.08747760346085842,Administer basic health care or medical treatments.,Assisting and Caring for Others
Administer blood or other fluids intravenously.,0.03484958223199408,Administer basic health care or medical treatments.,Assisting and Caring for Others
Administer cancer treatments.,-0.018601229736834313,"Treat injuries, illnesses, or diseases.",Assisting and Caring for Others
Administer compensation or benefits programs.,0.011368755924052287,Perform human resources activities.,Staffing Organizational Units
Administer drug screening tests.,0.0,Administer diagnostic tests to assess patient health.,"Inspecting Equipment, Structures, or Material"
Administer first aid.,0.45228814353048064,Administer emergency medical treatment.,Assisting and Caring for Others
Administer intravenous medications.,0.01369285982668389,Administer basic health care or medical treatments.,Assisting and Caring for Others
Administer medical substances for imaging or other procedures.,0.0,Administer basic health care or medical treatments.,Assisting and Caring for Others
Administer non-intravenous medications.,-0.01920189800814409,Administer basic health care or medical treatments.,Assisting and Caring for Others
Administer oaths to court participants.,-0.05129130648093794,Perform court-related or other legal administrative activities.,Performing Administrative Activities
Administer personnel recruitment or hiring activities.,-0.4030892926350309,Perform recruiting or hiring activities.,Staffing Organizational Units
Administer screening tests to determine abilities or treatment needs.,-0.004426083957298488,Administer diagnostic tests to assess patient health.,"Inspecting Equipment, Structures, or Material"
Administer standardized physical or psychological tests.,0.05040875959833713,Perform human resources activities.,Staffing Organizational Units
Administer tests to assess educational needs or progress.,-0.22311720476441677,"Assess student capabilities, needs, or performance.","Judging the Qualities of Things, Services, or People"
Administer therapeutic massages.,-0.010104462367723777,Administer therapeutic treatments.,Assisting and Caring for Others
Administer therapy treatments to patients using hands or physical treatment aids.,0.7217877618870352,Administer therapeutic treatments.,Assisting and Caring for Others
"Advise athletes, coaches, or trainers on exercise regimens, nutrition, or equipment use.",-0.006313850316142844,Advise others on healthcare or wellness issues.,Provide Consultation and Advice to Others
Advise clients or community groups on health issues.,-0.5302635609412789,Advise others on healthcare or wellness issues.,Provide Consultation and Advice to Others
Advise communities or institutions regarding health or safety issues.,-0.12237796652556154,Advise others on healthcare or wellness issues.,Provide Consultation and Advice to Others
Advise customers on technical or procedural issues.,-0.024021937013610106,Advise others on products or services.,Provide Consultation and Advice to Others
Advise customers on the use of products or services.,-0.7350570459043269,Advise others on products or services.,Provide Consultation and Advice to Others
"Advise educators on curricula, instructional methods, or policies.",-0.9714943008272638,Advise others on educational or vocational matters.,Provide Consultation and Advice to Others
Advise medical personnel regarding healthcare issues.,0.1556047709873818,Advise others on healthcare or wellness issues.,Provide Consultation and Advice to Others
Advise others about environmental management or conservation.,0.3810671879489682,Advise others on environmental sustainability or green practices.,Provide Consultation and Advice to Others
Advise others about land management or conservation.,0.15267853599981063,Advise others on environmental sustainability or green practices.,Provide Consultation and Advice to Others
Advise others on analytical techniques.,-0.04100543838557957,Advise others on business or operational matters.,Provide Consultation and Advice to Others
Advise others on business or operational matters.,-0.28056344980391223,Advise others on business or operational matters.,Provide Consultation and Advice to Others
Advise others on career or personal development.,-0.07257371908243782,Advise others on educational or vocational matters.,Provide Consultation and Advice to Others
Advise others on educational matters.,0.002508355174721366,Advise others on educational or vocational matters.,Provide Consultation and Advice to Others
"Advise others on farming or forestry operations, regulations, or equipment.",-0.11922921392908759,Advise others on business or operational matters.,Provide Consultation and Advice to Others
Advise others on financial matters.,0.3757586166833864,Advise others on financial matters.,Provide Consultation and Advice to Others
Advise others on green energy or related technologies.,0.0,Advise others on environmental sustainability or green practices.,Provide Consultation and Advice to Others
Advise others on health and safety issues.,-0.20617991620134557,Advise others on workplace health or safety issues.,Provide Consultation and Advice to Others
Advise others on healthcare matters.,0.020129252991750946,Advise others on healthcare or wellness issues.,Provide Consultation and Advice to Others
Advise others on human resources topics.,-0.5895770344528777,Advise others on business or operational matters.,Provide Consultation and Advice to Others
"Advise others on issues related to repairs, installation, or equipment design.",0.04511012530277636,Advise others on business or operational matters.,Provide Consultation and Advice to Others
Advise others on legal or regulatory compliance matters.,1.5645124218821516,Advise others on legal or regulatory matters.,Provide Consultation and Advice to Others
Advise others on logistics topics.,0.005022602945788712,Advise others on business or operational matters.,Provide Consultation and Advice to Others
Advise others on management of emergencies or hazardous situations or materials.,0.02292306083646256,Advise others on workplace health or safety issues.,Provide Consultation and Advice to Others
Advise others on matters of public policy.,-0.07626095735064098,Advise others on legal or regulatory matters.,Provide Consultation and Advice to Others
Advise others on social or educational issues.,0.06787543478537339,Advise others on educational or vocational matters.,Provide Consultation and Advice to Others
Advise others on the development or use of new technologies.,-0.00255954163823624,Advise others on the design or use of technologies.,Provide Consultation and Advice to Others
Advise others on ways to improve processes or products.,0.1614444283703449,Advise others on business or operational matters.,Provide Consultation and Advice to Others
Advise others regarding green practices or environmental concerns.,-0.02956367366270074,Advise others on environmental sustainability or green practices.,Provide Consultation and Advice to Others
Advise patients on effects of health conditions or treatments.,-0.010313220025238046,Advise patients or clients on medical issues.,Provide Consultation and Advice to Others
Advise patients on healthcare system processes.,-0.03647169434256092,Advise patients or clients on medical issues.,Provide Consultation and Advice to Others
Advise patients on preventive care techniques.,0.06817406719259722,Advise patients or clients on medical issues.,Provide Consultation and Advice to Others
Advise real estate clients.,-0.04709425453219618,Advise others on financial matters.,Provide Consultation and Advice to Others
Advise students on academic or career matters.,0.2833221310326093,Advise others on educational or vocational matters.,Provide Consultation and Advice to Others
Advocate for individual or community needs.,0.014125330248553336,Advocate for individual or community needs.,Selling or Influencing Others
Align equipment or machinery.,0.3847860724848169,Position materials or components for assembly.,Handling and Moving Objects
Align masonry materials.,0.04069077790835163,Position materials or components for assembly.,Handling and Moving Objects
Align parts or workpieces to ensure proper assembly.,1.2503000767564028,Position materials or components for assembly.,Handling and Moving Objects
Allocate physical resources within organizations.,0.0,"Distribute materials, supplies, or resources.",Monitoring and Controlling Resources
Analyze biological samples.,0.0184615168276423,Analyze biological or chemical substances or related data.,Analyzing Data or Information
Analyze budgetary or accounting data.,-0.0026033198887218667,Analyze business or financial data.,Analyzing Data or Information
Analyze business or financial data.,-0.531098909912592,Analyze business or financial data.,Analyzing Data or Information
Analyze chemical compounds or substances.,0.3001830088222581,Analyze biological or chemical substances or related data.,Analyzing Data or Information
Analyze consumer trends.,-0.3891018820218797,Analyze market or industry conditions.,Analyzing Data or Information
Analyze costs and benefits of proposed designs or projects.,-0.14336187935228928,"Evaluate designs, specifications, or other technical data.",Analyzing Data or Information
Analyze crime scene evidence.,-0.02149719409220907,Analyze biological or chemical substances or related data.,Analyzing Data or Information
Analyze data to assess operational or project effectiveness.,-0.0847992869879497,Analyze data to improve operations.,Analyzing Data or Information
Analyze data to determine project feasibility.,0.1340250271368557,Evaluate project feasibility.,"Judging the Qualities of Things, Services, or People"
Analyze data to identify or resolve operational problems.,-0.26816891827124145,Analyze data to improve operations.,Analyzing Data or Information
Analyze data to identify trends or relationships among variables.,0.24337119780809857,Analyze scientific or applied data using mathematical principles.,Analyzing Data or Information
Analyze data to inform operational decisions or activities.,0.107696484456139,Analyze data to improve operations.,Analyzing Data or Information
Analyze data to inform personnel decisions.,-0.0018567463655347893,Analyze data to improve operations.,Analyzing Data or Information
Analyze design or requirements information for mechanical equipment or systems.,-0.3940831298721368,"Evaluate designs, specifications, or other technical data.",Analyzing Data or Information
Analyze design requirements for computer or electronics systems.,-0.12861945559965893,"Evaluate designs, specifications, or other technical data.",Analyzing Data or Information
Analyze energy usage data.,-0.19517328899933428,Analyze data to improve operations.,Analyzing Data or Information
Analyze environmental data.,0.012534729412584156,Analyze environmental or geospatial data.,Analyzing Data or Information
Analyze environmental regulations to ensure organizational compliance.,0.0,Assess characteristics or impacts of regulations or policies.,Analyzing Data or Information
Analyze financial information.,-0.10648557398413949,Analyze business or financial data.,Analyzing Data or Information
Analyze financial records or reports to determine state of operations.,-0.14364127076623268,Analyze business or financial data.,Analyzing Data or Information
Analyze financial records to improve budgeting or planning.,0.03760041722459295,Analyze business or financial data.,Analyzing Data or Information
Analyze financial records to improve efficiency.,0.21240747433329643,Analyze business or financial data.,Analyzing Data or Information
Analyze forecasting data to improve business decisions.,-0.24636070777964791,Analyze data to improve operations.,Analyzing Data or Information
Analyze forensic evidence to solve crimes.,0.14479486653406726,Analyze biological or chemical substances or related data.,Analyzing Data or Information
Analyze geological or geographical data.,0.0907631352277245,Analyze environmental or geospatial data.,Analyzing Data or Information
Analyze geological samples.,-0.10634388262454442,Analyze environmental or geospatial data.,Analyzing Data or Information
Analyze green technology design requirements.,0.0,"Evaluate designs, specifications, or other technical data.",Analyzing Data or Information
Analyze health-related data.,0.10624359132852046,Analyze health or medical data.,Analyzing Data or Information
Analyze impact of legal or regulatory changes.,0.08020783553057598,Assess characteristics or impacts of regulations or policies.,Analyzing Data or Information
Analyze industry trends.,-0.17675969205606723,Analyze market or industry conditions.,Analyzing Data or Information
Analyze information obtained from news sources.,0.012100689746158633,"Develop news, entertainment, or artistic content.",Thinking Creatively
"Analyze jobs using observation, survey, or interview techniques.",-0.15209352026921863,Analyze data to improve operations.,Analyzing Data or Information
Analyze laboratory findings.,0.04479177675254764,Analyze biological or chemical substances or related data.,Analyzing Data or Information
Analyze laboratory specimens to detect abnormalities or other problems.,0.06170630435598934,Analyze biological or chemical substances or related data.,Analyzing Data or Information
Analyze logistics processes.,-0.036977602937842136,Analyze data to improve operations.,Analyzing Data or Information
Analyze market conditions or trends.,-1.8593463999119182,Analyze market or industry conditions.,Analyzing Data or Information
Analyze market or customer related data.,0.1552057136816618,Analyze market or industry conditions.,Analyzing Data or Information
Analyze market research data.,0.06312375371058287,Analyze market or industry conditions.,Analyzing Data or Information
Analyze medical data to determine cause of death.,-0.10471140423988601,Analyze health or medical data.,Analyzing Data or Information
"Analyze operational data to evaluate operations, processes or products.",-0.067440360287911,Analyze data to improve operations.,Analyzing Data or Information
Analyze operational or research data.,0.085171660909237,Analyze data to improve operations.,Analyzing Data or Information
Analyze patient data to determine patient needs or treatment goals.,-0.11010335405196692,Analyze health or medical data.,Analyzing Data or Information
"Analyze physical, survey, or geographic data.",0.17968881728062458,Analyze environmental or geospatial data.,Analyzing Data or Information
Analyze project data to determine specifications or requirements.,-0.056052088970116376,"Evaluate designs, specifications, or other technical data.",Analyzing Data or Information
Analyze quantitative data to determine effectiveness of treatments or therapies.,-0.027254451195941165,Analyze health or medical data.,Analyzing Data or Information
Analyze risks related to investments in green technology.,-0.05130786020138567,Analyze business or financial risks.,Analyzing Data or Information
Analyze risks to minimize losses or damages.,-0.19821368511144577,Analyze business or financial risks.,Analyzing Data or Information
"Analyze security of systems, network, or data.",-0.07160464161946312,Analyze performance of systems or equipment.,Analyzing Data or Information
Analyze shipping information to make routing decisions.,-0.326037546153338,Analyze data to improve operations.,Analyzing Data or Information
Analyze test data or images to inform diagnosis or treatment.,-0.21881902805879738,Analyze health or medical data.,Analyzing Data or Information
Analyze test or performance data to assess equipment operation.,-0.03597190522758087,Analyze performance of systems or equipment.,Analyzing Data or Information
Analyze test or validation data.,-0.13237532007475217,Analyze performance of systems or equipment.,Analyzing Data or Information
Analyze test results.,0.2994059929126669,Test characteristics of materials or products.,"Inspecting Equipment, Structures, or Material"
Analyze traffic data.,0.0,Analyze data to improve operations.,Analyzing Data or Information
Analyze website or related online data to track trends or usage.,-0.12170246254257933,Analyze market or industry conditions.,Analyzing Data or Information
Answer customer questions about goods or services.,-0.13518364520858928,Respond to customer problems or inquiries.,Performing for or Working Directly with the Public
Answer telephones to direct calls or provide information.,-0.1702048170663395,"Provide information to guests, clients, or customers.",Communicating with Persons Outside Organization
Apply adhesives to construction materials.,-0.0648640641078786,Perform general construction or extraction activities.,Performing General Physical Activities
"Apply bandages, dressings, or splints.",-0.0032024281135822896,Administer basic health care or medical treatments.,Assisting and Caring for Others
Apply chemical solutions to plants to protect against disease or insects or to enhance growth.,-0.12953020873228782,Apply protective solutions or coatings.,Handling and Moving Objects
"Apply cleansing or conditioning agents to client hair, scalp, or skin.",0.21917215214913455,Apply hygienic or cosmetic agents to skin or hair.,Handling and Moving Objects
Apply decorative coloring to photographs or printed materials.,0.003243974366074376,Apply decorative finishes.,Handling and Moving Objects
Apply decorative masonry finishes.,-0.09593277320452609,Apply decorative finishes.,Handling and Moving Objects
Apply decorative or textured finishes or coverings.,0.5305691908597829,Apply decorative finishes.,Handling and Moving Objects
"Apply finishes to artwork, crafts, or displays.",-0.32423536577600665,Apply decorative finishes.,Handling and Moving Objects
Apply identification labels or tags.,0.0,Mark materials or objects for identification.,"Identifying Objects, Actions, and Events"
Apply information technology to solve business or other applied problems.,0.16155245513025474,Design computer or information systems or applications.,Thinking Creatively
Apply knowledge or research findings to address environmental problems.,0.03134101697482272,Develop systems or practices to mitigate or resolve environmental problems.,Thinking Creatively
Apply lubricants or coolants to workpieces.,0.4322717938548273,Maintain tools or equipment.,Repairing and Maintaining Mechanical Equipment
Apply makeup to alter or enhance appearance.,-0.23147709673434047,Apply hygienic or cosmetic agents to skin or hair.,Handling and Moving Objects
Apply material to fill gaps in surfaces.,-0.3391596918831139,Apply materials to fill gaps or imperfections.,Handling and Moving Objects
Apply mathematical models of financial or business conditions.,-0.06294793893524897,Analyze business or financial data.,Analyzing Data or Information
Apply mathematical principles or statistical approaches to solve problems in scientific or applied fields.,0.02779269924234029,Analyze scientific or applied data using mathematical principles.,Analyzing Data or Information
Apply mortar.,0.025176282979383124,Apply materials to fill gaps or imperfections.,Handling and Moving Objects
Apply multiple teaching methods.,0.20158894781293357,Teach academic or vocational subjects.,Training and Teaching Others
Apply new technologies to improve work processes.,0.056533384576269885,Implement procedures or processes.,Making Decisions and Solving Problems
Apply paint to surfaces.,-0.02068005562052555,Apply protective solutions or coatings.,Handling and Moving Objects
Apply parting agents or other solutions to molds.,-0.4198514551511501,Remove workpieces from production equipment.,Handling and Moving Objects
Apply protective coverings to objects or surfaces near work areas.,0.005682178482490308,Set up protective structures or coverings near work areas.,Performing General Physical Activities
Apply protective or decorative finishes to workpieces or products.,0.43512749088242986,Apply protective solutions or coatings.,Handling and Moving Objects
Apply sealants or other protective coatings.,-0.0011404890810773338,Apply protective solutions or coatings.,Handling and Moving Objects
Apply solutions to hair for therapeutic or cosmetic purposes.,0.09888934675227112,Apply hygienic or cosmetic agents to skin or hair.,Handling and Moving Objects
Apply solutions to production equipment.,-0.43458586222017015,Apply protective solutions or coatings.,Handling and Moving Objects
Apply water or solutions to fabrics or apparel.,0.5307897324424773,"Clean workpieces, finished products, or other objects.",Performing General Physical Activities
Appraise environmental impact of regulations or policies.,0.026181816133278968,Assess characteristics or impacts of regulations or policies.,Analyzing Data or Information
Appraise property values.,0.04309356483838078,"Evaluate condition of financial assets, property, or other resources.","Judging the Qualities of Things, Services, or People"
Apprehend criminal suspects.,0.07138797589196866,Maintain safety or security.,Performing General Physical Activities
Approve expenditures.,-0.13466870796403585,Authorize business activities or transactions.,Making Decisions and Solving Problems
Arbitrate disputes between parties to resolve legal conflicts.,0.3391806464369642,Mediate disputes.,Resolving Conflicts and Negotiating with Others
"Arrange artwork, products, or props.",0.09505266558016467,Arrange displays or decorations.,Handling and Moving Objects
Arrange childcare or educational settings to ensure physical safety of children.,-0.023365494026205802,"Set up classrooms, facilities, educational materials, or equipment.",Handling and Moving Objects
Arrange collective bargaining agreements.,0.20351278446278664,Negotiate contracts or agreements.,Resolving Conflicts and Negotiating with Others
Arrange delivery of goods or services.,-0.09853957689582593,"Direct organizational operations, activities, or procedures.","Guiding, Directing, and Motivating Subordinates"
Arrange facility schedules.,0.01908785156416215,Prepare schedules for services or facilities.,Scheduling Work and Activities
Arrange food for serving.,0.047816876484569004,Prepare foods or beverages.,Handling and Moving Objects
Arrange insurance coverage.,0.014502269932017864,Execute financial transactions.,Performing Administrative Activities
Arrange items for use or display.,0.12875483356541917,Arrange displays or decorations.,Handling and Moving Objects
