detailed_work_activity,impact,intermediate_work_activity,element
"Inspect metal, plastic, or composite products.",0.5062452546834937,Inspect completed work or finished products.,"Inspecting Equipment, Structures, or Material"
Inspect motor vehicles.,-0.36582548025757555,Inspect vehicles.,"Inspecting Equipment, Structures, or Material"
Inspect operational processes.,-0.15571186033034312,Monitor operations to ensure adequate performance.,"Monitor Processes, Materials, or Surroundings"
Inspect operations of green energy facilities.,0.0,Monitor operations to ensure adequate performance.,"Monitor Processes, Materials, or Surroundings"
Inspect plumbing systems or fixtures.,0.21601204906708382,"Inspect commercial, industrial, or production systems or equipment.","Inspecting Equipment, Structures, or Material"
Inspect production equipment.,-4.519369358717227,"Inspect commercial, industrial, or production systems or equipment.","Inspecting Equipment, Structures, or Material"
Inspect products or operations to ensure that standards are met.,-0.4520354309472836,Monitor operations to ensure compliance with regulations or standards.,"Monitor Processes, Materials, or Surroundings"
Inspect safety equipment to ensure proper functioning.,-0.007063906276163934,"Inspect commercial, industrial, or production systems or equipment.","Inspecting Equipment, Structures, or Material"
Inspect sets or exhibits.,0.10345036632390059,Inspect completed work or finished products.,"Inspecting Equipment, Structures, or Material"
Inspect shipments to ensure correct order fulfillment.,0.1308714162984952,Inspect characteristics or conditions of materials or products.,"Inspecting Equipment, Structures, or Material"
Inspect structural components of vehicles to identify problems.,-0.13599572517398162,Inspect vehicles.,"Inspecting Equipment, Structures, or Material"
Inspect sustainable energy production facilities or equipment.,-0.039985654608248655,"Inspect commercial, industrial, or production systems or equipment.","Inspecting Equipment, Structures, or Material"
Inspect systems to determine if they are operating properly.,-0.06668014772822772,"Inspect commercial, industrial, or production systems or equipment.","Inspecting Equipment, Structures, or Material"
Inspect telecommunications equipment to identify problems.,-0.05570682832446083,"Inspect commercial, industrial, or production systems or equipment.","Inspecting Equipment, Structures, or Material"
Inspect textile products.,0.6806069952986498,Inspect completed work or finished products.,"Inspecting Equipment, Structures, or Material"
Inspect timing devices.,0.0,Inspect completed work or finished products.,"Inspecting Equipment, Structures, or Material"
Inspect vehicles to determine overall condition.,-0.001755312629193817,Inspect vehicles.,"Inspecting Equipment, Structures, or Material"
Inspect work environments to ensure safety.,0.27076541018125866,Inspect facilities or equipment.,"Inspecting Equipment, Structures, or Material"
Inspect work sites to determine condition or necessary repairs.,0.2791280542495951,Inspect facilities or equipment.,"Inspecting Equipment, Structures, or Material"
Inspect work sites to identify potential environmental or safety hazards.,0.055061874130940325,Inspect facilities or equipment.,"Inspecting Equipment, Structures, or Material"
Inspect work to ensure standards are met.,0.05333108550991561,Inspect completed work or finished products.,"Inspecting Equipment, Structures, or Material"
Inspected printed materials or other images to verify quality.,-0.3370869924191222,Inspect completed work or finished products.,"Inspecting Equipment, Structures, or Material"
Install audio or communications equipment.,0.047139080084677154,Install commercial or production equipment.,Handling and Moving Objects
Install building fixtures.,0.05518333824168131,Build structures.,Handling and Moving Objects
Install carpet or flooring.,0.026339695871420155,Build structures.,Handling and Moving Objects
Install computer hardware.,-0.08022890110499814,"Set up computer systems, networks, or other information systems.",Interacting With Computers
Install computer software.,-0.017571911359658188,"Set up computer systems, networks, or other information systems.",Interacting With Computers
Install doors or windows.,-0.01687887244450037,Build structures.,Handling and Moving Objects
Install drilling equipment.,-0.10182524236999813,Install commercial or production equipment.,Handling and Moving Objects
"Install electrical components, equipment, or systems.",0.22761503136833827,Install commercial or production equipment.,Handling and Moving Objects
"Install energy-efficient heating, ventilation, or air conditioning (HVAC) equipment.",-0.15203180633656288,Install energy or heating equipment.,Handling and Moving Objects
Install equipment attachments or components.,-0.1626573198699668,Set up equipment.,Handling and Moving Objects
Install equipment to protect or support trees.,-0.04770966124139786,Build structures.,Handling and Moving Objects
Install fencing or other barriers.,-0.04440968142813606,Build structures.,Handling and Moving Objects
Install gauges or controls.,0.13584766935581305,Assemble equipment or components.,Handling and Moving Objects
Install green plumbing or water handling systems.,-0.2427352954754709,Install plumbing or piping equipment or systems.,Handling and Moving Objects
"Install green structural components, equipment or systems.",0.00949590742424844,Build structures.,Handling and Moving Objects
Install hardware or other interior fixtures.,-0.027448419778555166,Build structures.,Handling and Moving Objects
"Install heating, ventilation, or air conditioning (HVAC) equipment.",-0.017288080502316117,Install energy or heating equipment.,Handling and Moving Objects
Install home appliances.,-0.008687485693431807,Install commercial or production equipment.,Handling and Moving Objects
Install instrumentation or electronic equipment or systems.,-0.008318734245123416,Install commercial or production equipment.,Handling and Moving Objects
Install insulation in equipment or structures.,0.10083043771609468,Build structures.,Handling and Moving Objects
Install machine or equipment replacement parts.,-0.08689375614903172,Assemble equipment or components.,Handling and Moving Objects
Install masonry materials.,0.2806585232590195,Build structures.,Handling and Moving Objects
Install mechanical components in production equipment.,0.4868906985788173,Set up equipment.,Handling and Moving Objects
Install metal structural components.,0.13719315496409745,Build structures.,Handling and Moving Objects
Install metering equipment.,0.0,Install commercial or production equipment.,Handling and Moving Objects
"Install parts, assemblies, or attachments in transportation or material handling equipment.",-0.003292783407734312,Assemble equipment or components.,Handling and Moving Objects
Install piping for installation or maintenance activities.,-0.0018904905604655298,Install plumbing or piping equipment or systems.,Handling and Moving Objects
Install plumbing or piping.,0.027849448446155556,Install plumbing or piping equipment or systems.,Handling and Moving Objects
Install production equipment or systems.,0.001533253319148109,Install commercial or production equipment.,Handling and Moving Objects
Install programs onto computer or computer-controlled equipment.,-0.09951741625793664,"Set up computer systems, networks, or other information systems.",Interacting With Computers
Install roofing materials.,-0.05417349571897789,Build structures.,Handling and Moving Objects
Install safety or support equipment.,0.0,Build structures.,Handling and Moving Objects
Install solar energy systems.,0.01225782436650924,Install energy or heating equipment.,Handling and Moving Objects
Install structural foundations.,-0.1367110210000022,Build structures.,Handling and Moving Objects
Install trim or paneling.,-0.009169827722151247,Build structures.,Handling and Moving Objects
Install vehicle parts or accessories.,0.1803219388089281,Assemble equipment or components.,Handling and Moving Objects
Install wooden structural components.,0.09259557867525903,Build structures.,Handling and Moving Objects
Instruct college students in physical or life sciences.,0.051402812660187536,Teach academic or vocational subjects.,Training and Teaching Others
Instruct college students in social sciences or humanities disciplines.,0.4213068015665513,Teach academic or vocational subjects.,Training and Teaching Others
Instruct patients in the use of assistive equipment.,-0.13861958602249036,Train others to use equipment or products.,Training and Teaching Others
Instruct staff in work policies or procedures.,-0.15050706452850937,Train others on operational or work procedures.,Training and Teaching Others
Instruct workers to use equipment or perform technical procedures.,-0.03925612100454323,Train others to use equipment or products.,Training and Teaching Others
Interact with patients to build rapport or provide emotional support.,0.04977583592814083,Provide support or encouragement to others.,Coaching and Developing Others
"Interpret blueprints, specifications, or diagrams to inform installation, development or operation activities.",-0.4340339999491136,Read documents or materials to inform work processes.,Getting Information
Interpret cultural or religious information for others.,-0.08891685044573627,"Interpret language, cultural, or religious information for others.",Interpreting the Meaning of Information for Others
Interpret design or operational test results.,0.0037514530000128943,Analyze performance of systems or equipment.,Analyzing Data or Information
Interpret financial information for others.,0.3625857798815839,Explain financial information.,Interpreting the Meaning of Information for Others
Interpret research or operational data.,0.988788564008567,Analyze data to improve operations.,Analyzing Data or Information
Intervene in crisis situations to assist clients.,-0.29139122325471467,Counsel others about personal matters.,Provide Consultation and Advice to Others
Interview claimants to get information related to legal proceedings.,0.07146881618671141,Interview people to obtain information.,Getting Information
Interview clients to gather financial information.,0.07089065103446224,Interview people to obtain information.,Getting Information
"Interview clients to gather information about their backgrounds, needs, or progress.",-0.1694247232812165,Interview people to obtain information.,Getting Information
"Interview employees, customers, or others to collect information.",0.9540266710486822,Interview people to obtain information.,Getting Information
Interview others for news or entertainment purposes.,-0.03335481097462445,Interview people to obtain information.,Getting Information
Interview patients to gather medical information.,-0.05200323073788926,Interview people to obtain information.,Getting Information
Interview people to gather information about criminal activities.,-0.007993364375685541,Interview people to obtain information.,Getting Information
Interview people to obtain information about actions or status of individuals.,-0.014713942461876961,Interview people to obtain information.,Getting Information
"Interview witnesses, suspects, or claimants.",0.12667900771740692,Interview people to obtain information.,Getting Information
Inventory materials or equipment.,-0.2159542776525205,Monitor resources or inventories.,Monitoring and Controlling Resources
Inventory medical supplies or equipment.,-0.11443550713045836,Monitor resources or inventories.,Monitoring and Controlling Resources
Investigate accidents to determine causes.,0.027800724493438178,Investigate incidents or accidents.,Getting Information
Investigate crimes committed within organizations.,0.09201277814271114,Investigate criminal or legal matters.,Getting Information
Investigate illegal or suspicious activities.,0.08308002324283681,Investigate criminal or legal matters.,Getting Information
Investigate industrial or transportation accidents.,0.056275479031669295,Investigate incidents or accidents.,Getting Information
Investigate legal issues.,0.06041988121020969,Investigate criminal or legal matters.,Getting Information
Investigate personal characteristics or activities of individuals.,-0.027829839530354672,"Investigate individuals' background, behavior, or activities.",Getting Information
Investigate safety of work environment.,0.02384367035095547,Investigate organizational or operational problems.,Getting Information
"Investigate system, equipment, or product failures.",-0.002126602832430713,Investigate organizational or operational problems.,Getting Information
Investigate the environmental impact of projects.,-0.06337732283227338,Investigate the environmental impact of industrial or development activities.,Getting Information
"Investigate transportation incidents, violations, or complaints.",0.03675922786838193,Investigate incidents or accidents.,Getting Information
Investigate work related complaints to determine corrective actions.,-0.12853825440204236,Investigate organizational or operational problems.,Getting Information
"Irrigate lawns, trees, or plants.",0.05793144835114017,Perform agricultural activities.,Performing General Physical Activities
Issue certificates or licenses.,-0.045362435198402995,Issue documentation.,Performing Administrative Activities
Issue documentation or identification to customers or employees.,-0.04682036817710733,Issue documentation.,Performing Administrative Activities
"Issue money, credit, or vouchers.",-0.04481140529915972,Execute financial transactions.,Performing Administrative Activities
Issue permits or other legal documents.,0.03710445317716227,Issue documentation.,Performing Administrative Activities
Issue warnings or citations.,0.029102074600140693,Issue documentation.,Performing Administrative Activities
Label production materials.,0.0023798753268975403,Mark materials or objects for identification.,"Identifying Objects, Actions, and Events"
Lay cables to connect equipment.,-0.4016601060146563,Connect components or supply lines to equipment or tools.,Handling and Moving Objects
Lay out parts to prepare for assembly.,-0.04134568407597383,Position materials or components for assembly.,Handling and Moving Objects
Lay out work according to specifications.,0.04477155436728353,Position materials or components for assembly.,Handling and Moving Objects
Lead classes or community events.,0.3760076225819837,Teach academic or vocational subjects.,Training and Teaching Others
Level machines or equipment.,0.04916806376991012,Position tools or equipment.,Handling and Moving Objects
Liaise between departments or other groups to improve function or communication.,0.804711210152449,Communicate with others about operational plans or activities.,"Communicating with Supervisors, Peers, or Subordinates"
Lift materials or workpieces using cranes or other lifting equipment.,-0.3995498022180146,Operate lifting or moving equipment.,Controlling Machines and Processes
Load agricultural or forestry products for shipment.,-0.0740375974543035,"Load products, materials, or equipment for transportation or further processing.",Performing General Physical Activities
Load digital images onto computers or websites.,-0.050786747622469264,Process digital or online data.,Interacting With Computers
Load items into ovens or furnaces.,-0.3333327198397731,"Load products, materials, or equipment for transportation or further processing.",Performing General Physical Activities
Load materials into construction equipment.,-0.20060767024371362,"Load products, materials, or equipment for transportation or further processing.",Performing General Physical Activities
Load materials into equipment for processing.,0.0059066271233452206,"Load products, materials, or equipment for transportation or further processing.",Performing General Physical Activities
Load materials into production equipment.,0.9076415447289463,"Load products, materials, or equipment for transportation or further processing.",Performing General Physical Activities
Load materials or equipment.,0.0018207941405585792,"Load products, materials, or equipment for transportation or further processing.",Performing General Physical Activities
Load or unload materials used in construction or extraction.,0.04399443465400665,"Load products, materials, or equipment for transportation or further processing.",Performing General Physical Activities
"Load shipments, belongings, or materials.",-0.20657890947938684,"Load products, materials, or equipment for transportation or further processing.",Performing General Physical Activities
Locate animals for fishing or hunting purposes.,0.050642050110138115,Hunt animals.,Handling and Moving Objects
Locate equipment or materials in need of repair or replacement.,-0.03390995685925757,"Inspect commercial, industrial, or production systems or equipment.","Inspecting Equipment, Structures, or Material"
Locate fires or fire danger areas.,-0.02066172229135077,"Monitor safety or security of work areas, facilities, or properties.","Monitor Processes, Materials, or Surroundings"
Locate natural resources using geospatial or other environmental data.,-0.10947973753928464,Analyze environmental or geospatial data.,Analyzing Data or Information
Locate suspicious objects or vehicles.,0.02900650559564788,"Monitor safety or security of work areas, facilities, or properties.","Monitor Processes, Materials, or Surroundings"
Lubricate equipment to allow proper functioning.,0.10195637200639807,Maintain tools or equipment.,Repairing and Maintaining Mechanical Equipment
Lubricate production equipment.,-0.22230415491366973,Maintain tools or equipment.,Repairing and Maintaining Mechanical Equipment
Maintain call records.,0.026566499654044673,Maintain operational records.,Documenting/Recording Information
Maintain clean work areas.,0.03852176348689884,"Clean tools, equipment, facilities, or work areas.",Performing General Physical Activities
Maintain client information or service records.,-0.3724175201798583,Maintain operational records.,Documenting/Recording Information
Maintain client records.,0.006943951314184904,Maintain health or medical records.,Documenting/Recording Information
Maintain computer equipment or software.,-0.0034347513030255072,"Maintain electronic, computer, or other technical equipment.",Repairing and Maintaining Mechanical Equipment
Maintain computer hardware.,-0.14114787773273996,"Maintain electronic, computer, or other technical equipment.",Repairing and Maintaining Mechanical Equipment
Maintain computer networks to enhance performance and user access.,-0.11314685877746022,"Maintain electronic, computer, or other technical equipment.",Repairing and Maintaining Mechanical Equipment
Maintain construction tools or equipment.,-0.008452367172101294,Maintain tools or equipment.,Repairing and Maintaining Mechanical Equipment
Maintain contingency plans for disaster recovery.,-0.03524665569452612,Develop contingency or emergency response plans.,Thinking Creatively
Maintain current knowledge related to work activities.,0.14810414415360862,Maintain current knowledge in area of expertise.,Updating and Using Relevant Knowledge
Maintain data in information systems or databases.,0.001961015963475532,Maintain operational records.,Documenting/Recording Information
Maintain drilling equipment.,0.022381746314333206,Maintain tools or equipment.,Repairing and Maintaining Mechanical Equipment
Maintain electromechanical equipment.,0.0,Maintain tools or equipment.,Repairing and Maintaining Mechanical Equipment
Maintain electronic equipment.,0.22044417788665305,"Maintain electronic, computer, or other technical equipment.",Repairing and Maintaining Mechanical Equipment
Maintain equipment or systems to ensure proper functioning.,-0.06247668364389947,Maintain tools or equipment.,Repairing and Maintaining Mechanical Equipment
Maintain extraction or excavation equipment.,-0.04187034562451242,Maintain tools or equipment.,Repairing and Maintaining Mechanical Equipment
Maintain facilities.,-0.03152815181557367,Maintain facilities or equipment.,Repairing and Maintaining Mechanical Equipment
Maintain financial or account records.,-0.30136174927038306,Maintain sales or financial records.,Documenting/Recording Information
Maintain fire fighting tools or equipment.,-8.062406275488598e-06,Maintain tools or equipment.,Repairing and Maintaining Mechanical Equipment
"Maintain food, beverage, or equipment inventories.",-0.03640043010769256,"Replenish inventories of materials, equipment, or products.",Monitoring and Controlling Resources
"Maintain forestry, hunting, or agricultural equipment.",-0.556446553154744,Maintain tools or equipment.,Repairing and Maintaining Mechanical Equipment
Maintain green energy production plant equipment.,0.0,Maintain tools or equipment.,Repairing and Maintaining Mechanical Equipment
"Maintain inventories of materials, equipment, or products.",3.057229193385718,"Replenish inventories of materials, equipment, or products.",Monitoring and Controlling Resources
Maintain inventory of medical supplies or equipment.,-0.13792488083988363,"Replenish inventories of materials, equipment, or products.",Monitoring and Controlling Resources
Maintain inventory records.,-0.06803459491397668,Maintain operational records.,Documenting/Recording Information
Maintain knowledge of business operations.,0.10492448722213421,Maintain current knowledge in area of expertise.,Updating and Using Relevant Knowledge
Maintain knowledge of current developments in area of expertise.,-0.4323858852985043,Maintain current knowledge in area of expertise.,Updating and Using Relevant Knowledge
Maintain knowledge of laws or regulations.,-0.013938346169505955,Maintain current knowledge in area of expertise.,Updating and Using Relevant Knowledge
Maintain laboratory or technical equipment.,0.07181584095948912,"Maintain electronic, computer, or other technical equipment.",Repairing and Maintaining Mechanical Equipment
Maintain locomotives or other rail equipment in good working condition.,0.07452290438918929,Maintain vehicles in working condition.,Repairing and Maintaining Mechanical Equipment
Maintain logs of production activities.,-0.3219294263386594,Maintain operational records.,Documenting/Recording Information
Maintain material moving equipment in good working condition.,-0.2757128614473383,Maintain vehicles in working condition.,Repairing and Maintaining Mechanical Equipment
Maintain mechanical equipment.,0.32422013641504144,Maintain tools or equipment.,Repairing and Maintaining Mechanical Equipment
Maintain medical equipment or instruments.,-0.10345902392098205,Maintain medical equipment or instruments.,Repairing and Maintaining Mechanical Equipment
Maintain medical facility records.,0.02492993396583998,Maintain health or medical records.,Documenting/Recording Information
Maintain medical laboratory equipment.,-0.04477544566601077,Maintain medical equipment or instruments.,Repairing and Maintaining Mechanical Equipment
Maintain medical or professional knowledge.,0.5350248858218589,Maintain current knowledge in area of expertise.,Updating and Using Relevant Knowledge
Maintain medical records.,-0.015397022243910818,Maintain health or medical records.,Documenting/Recording Information
Maintain office equipment in proper operating condition.,-0.028617812761879247,Maintain tools or equipment.,Repairing and Maintaining Mechanical Equipment
Maintain operational records for green energy processes or other environmentally-sustainable activities.,0.01581172330531322,Maintain operational records.,Documenting/Recording Information
Maintain operational records or records systems.,0.17597665807302354,Maintain operational records.,Documenting/Recording Information
Maintain operational records.,0.5822821292772642,Maintain operational records.,Documenting/Recording Information
Maintain personnel records.,0.05046993146116696,Maintain operational records.,Documenting/Recording Information
Maintain plumbing structures or fixtures.,-0.050999086502454105,Maintain facilities or equipment.,Repairing and Maintaining Mechanical Equipment
Maintain production or processing equipment.,-0.2499931180145758,Maintain tools or equipment.,Repairing and Maintaining Mechanical Equipment
Maintain professional knowledge or certifications.,-0.1048356079028232,Maintain current knowledge in area of expertise.,Updating and Using Relevant Knowledge
Maintain professional social services knowledge.,-0.07795477147654273,Maintain current knowledge in area of expertise.,Updating and Using Relevant Knowledge
Maintain public order or security.,-0.03163811529045368,Maintain safety or security.,Performing General Physical Activities
Maintain recording or broadcasting equipment.,-0.08616835959389224,"Maintain electronic, computer, or other technical equipment.",Repairing and Maintaining Mechanical Equipment
Maintain records of customer accounts.,-0.060448093503037814,Maintain operational records.,Documenting/Recording Information
Maintain records of sales or other business transactions.,-0.2646134497480892,Maintain sales or financial records.,Documenting/Recording Information
"Maintain records, documents, or other files.",0.11470131045408039,Maintain operational records.,Documenting/Recording Information
Maintain regulatory or compliance documentation.,0.1218668448757998,Prepare legal or regulatory documents.,Documenting/Recording Information
Maintain repair or maintenance records.,-0.206628535333107,Maintain operational records.,Documenting/Recording Information
Maintain security.,-0.003972544492190533,Maintain safety or security.,Performing General Physical Activities
Maintain social services program records.,0.0699390035732872,Maintain operational records.,Documenting/Recording Information
